{
  "schemaVersion": 1,
  "id": "testing-college-plan",
  "major": "test",
  "degree": "البكالوريوس",
  "expectedCredits": 0,
  "sharedSemesterSets": [
    "cfy-humanities"
  ],
  "semesters": [
    {
      "id": "published-level-1",
      "courses": []
    }
  ],
  "electiveGroups": [],
  "fallbackCourses": {}
}
