{
  "schemaVersion": 1,
  "id": "pgen",
  "major": "هندسة البترول والغاز الطبيعي",
  "degree": "البكالوريوس",
  "expectedCredits": 0,
  "sharedSemesterSets": [
    "cfy-scientific",
    "eng-cfy"
  ],
  "semesters": [
    {
      "id": "published-level-1",
      "courses": []
    }
  ],
  "electiveGroups": [],
  "fallbackCourses": {}
}
