{
  "schemaVersion": 1,
  "id": "oper",
  "major": "بحوث العمليات",
  "degree": "البكالوريوس",
  "expectedCredits": 0,
  "sharedSemesterSets": [
    "cfy-scientific"
  ],
  "semesters": [
    {
      "id": "published-level-1",
      "courses": []
    }
  ],
  "electiveGroups": [],
  "fallbackCourses": {}
}
